### ISSUE TITLE
Possible WebSocket opcode issues?

### ISSUE THREAD

**Issue by oldmancoyote** [civetweb/civetweb#586]
I was wondering if the WebSocket portion of the code adheres to the RFC-6455 specification. 

After hooking up Wireshark WebSocket sniffer, we're seeing occasional pong '0xA' opcodes coming out of the traffic, that have not been proceeded by a ping opcode '0x9'. According to the specification, either client or server can issue a ping, but it must be proceeded by the pong opcode. Our client who is using our application will see a disconnection message coming out of the client as well. And according to the spec, the server should be the only one to issue a disconnect.

Thanks!

**Comment by bel2125** [comment]
I think, I did not exactly get the point - please help me to understand the issue in more detain. 
I checked for possible RFC violations and found none (see bottom of this post). But I did not get the *underlying problem*: what kind of problem is the current behaviour causing? Is there a way I can reproduce it?


> Our client who is using our application will see a disconnection message coming out of the client as well. 
> And according to the spec, the server should be the only one to issue a disconnect.

What *exactly* do you mean by "disconnect"?
The [RFC Section 7.1.2](https://tools.ietf.org/html/rfc6455#section-7.1.2) explains a "close" of the websocket connection, but this can be initiated from both sides (all "endpoints").
The underlying TCP/IP can "disconnect", but this is usually either a network error, or some DoS (denial of service) prevention algorithm. CivetWeb has some to drop connections without  proper HTTP close response (not sure about WS) as a means of DoS protection - every "real world" server must have something like this, otherwise I would kill every high end web server with two 10 year old PCs and 10 lines of script.


According to [RFC Section 7.1.2](https://tools.ietf.org/html/rfc6455#section-5.5.2) every side can send a ping. There is no "you must not send PONG without PING", but in [RFC Section 5.5.3](https://tools.ietf.org/html/rfc6455#section-5.5.3) I found:

>    A Pong frame MAY be sent unsolicited.  This serves as a
   unidirectional heartbeat.  A response to an unsolicited Pong frame is
   not expected.

**Comment by oldmancoyote** [comment]
I'm gather additional information from what they are seeing on their WebSocket server at this time. They are using the Project Grizzly Java WebSocket as their server implementation. Should I post up detail on their forum or take this off line?

**Comment by bel2125** [comment]
So, CivetWeb is the websocket client and Project Grizzly is the websocket server?

From my point of view, you can post it here - still everybody can feel free to *not read* it, if it's not important for them. This forum is also a kind of additional documentation.
If you think the data should not be public, you can send it by mail as well.

**Comment by oldmancoyote** [comment]
It appears that the WebSocket server (being hosted by Project Grizzly) is sending no data after the initial upgrade of the protocol, since I'm getting the "No data received" string (civetweb.c, line 15416) from the get_message message. I am assuming the civetweb client is sending periodic Pings (0x9 data, account to the RFC spec) and an expectant message of 0xA (Pong) should be received.

**Comment by bel2125** [comment]
So, civetweb is websocket client here.

The websocket client does not send a ping autonomously. Also for the server you need to explicitly enable it using a configuration:
`{"enable_websocket_ping_pong", MG_CONFIG_TYPE_BOOLEAN, "no"},`
Or, are you sending the PING explicitly by an `mg_websocket_client_write` API call?

what version are you usint? Line 15416 in the current head is
https://github.com/civetweb/civetweb/blob/1a7f248e2388c35f4e2bcb32f9da380fad8aa460/src/civetweb.c#L15416

**Comment by oldmancoyote** [comment]
How do I turn on logging (mg_cry callback) for a WebSocket client setup?

I see the mg_start takes a callback structure (mg_callback), but how do I setup setup the logging callback for a WebSocket client? I call _mg_connect_websocket_client_ for a connection object, make repeated calls to _mg_websocket_client_write_ until a receive a close callback.

Thanks

**Comment by oldmancoyote** [comment]
I am not explicitly sending out a ping or pong message with the WebSocket client.

I'm calling _mg_connect_websocket_client_ once with the proper parameters, when a connection is needed. I then use _mg_websocket_client_write_ with with the WEBSOCKET_OPCODE_TEXT, to send out a string of characters. I will get a call back on the connection_close from time to time, which I then re-open. I'm still investigating why a disconnect happens, which is usually under heavy load. I do see a proper _Flag [F.]_ flag from the tcpdump though.

So, it's up to the developer to initiate the Ping on the client.

**Comment by oldmancoyote** [comment]
I believe I was up to date on the code until I realized that
`#define CIVETWEB_VERSION "1.11"`
does not get updated. I'll clone the latest version and run with that.

**Comment by bel2125** [comment]
I don't know if Project Grizzly server supports "PONG" - you could just call
`mg_websocket_client_write(conn_to_server, MG_WEBSOCKET_OPCODE_PING, &my_uint32_counter, sizeof(my_uint32_counter))` from your client and see what happens. You should get a call to the `data_func` registered by `mg_connect_websocket_client` with a PONG and the same data (my_uint32_counter).

**Comment by oldmancoyote** [comment]
I am seeing the WebSocket connection sending packet FIN flag (being send at random times) before it's closure. The question is, what would cause the WebSocket portion of civetweb to cause a closer - it's probably setting the _must_close_ to true.

```
19:22:12.360970 IP trictl05.8025 > 10.208.21.120.35002: Flags [.], ack 43437, win 1452, options [nop,nop,TS val 600197957 ecr 9159546], length 0
	0x0000:  04a3 16fd 4779 085b 0eaa d63e 0800 4500  ....Gy.[...>..E.
	0x0010:  0034 d35c 4000 3e06 3c4a 0ac9 020d 0ad0  .4.\@.>.<J......
	0x0020:  1578 1f59 88ba 9ee8 d09c 9171 7b75 8010  .x.Y.......q{u..
	0x0030:  05ac ec62 0000 0101 080a 23c6 4b45 008b  ...b......#.KE..
	0x0040:  c37a                                     .z
19:22:12.385288 IP trictl05.8025 > 10.208.21.120.35002: Flags [.], ack 43651, win 1452, options [nop,nop,TS val 600197963 ecr 9159549], length 0
	0x0000:  04a3 16fd 4779 085b 0eaa d63e 0800 4500  ....Gy.[...>..E.
	0x0010:  0034 d35d 4000 3e06 3c49 0ac9 020d 0ad0  .4.]@.>.<I......
	0x0020:  1578 1f59 88ba 9ee8 d09c 9171 7c4b 8010  .x.Y.......q|K..
	0x0030:  05ac eb83 0000 0101 080a 23c6 4b4b 008b  ..........#.KK..
	0x0040:  c37d                                     .}
19:22:12.392704 IP trictl05.8025 > 10.208.21.120.35002: Flags [F.], seq 0, ack 43759, win 1452, options [nop,nop,TS val 600197965 ecr 9159549], length 0
	0x0000:  04a3 16fd 4779 085b 0eaa d63e 0800 4500  ....Gy.[...>..E.
	0x0010:  0034 d35e 4000 3e06 3c48 0ac9 020d 0ad0  .4.^@.>.<H......
	0x0020:  1578 1f59 88ba 9ee8 d09c 9171 7cb7 8011  .x.Y.......q|...
	0x0030:  05ac eb14 0000 0101 080a 23c6 4b4d 008b  ..........#.KM..
	0x0040:  c37d                                     .}
```

**Comment by bel2125** [comment]
The current head version has several additional `DEBUG_TRACE` calls in the relevant functions - I can check if they are complete for all possible code paths closing a websocket connection.
If this situation can be reproduced, the best approach is to have a look at two, three logs from this situations.

**Comment by oldmancoyote** [comment]
I know it's a newbie question, but whats the easiest way to implement logging (say to a file)?

**Comment by bel2125** [comment]
Logging is already implemented. You just need to turn it on by building with the "DEBUG" define. If you use my Linux Makefile, it's what `make WITH_DEBUG=1` does. Or you just add `#define DEBUG' somewhere. 

Logging will write to 'stdout' by default. If you don't like this (e.g., you don't have a console), the easiest way is to replace the `printf` in `DEBUG_TRACE_FUNC` - there are more elegant ways if you want to have logging turned on in your production code, but for the moment let's stick to debugging this case using logging.

**Comment by bel2125** [comment]
And, if possible use version 55efefb471093136406797eb7c9f8769820a4cdb, since it has a couple of additional `DEBUG_TRACE` calls in `read_websocket`.

**Comment by bel2125** [comment]
Did you manage to activate logging, and got some insights?
Is there anything left to do here?
